[
  {
    "id": "fret.generator/bench",
    "kind": "copy",
    "source": "/Users/obsidian/Projects/hackbuild/fab-work-directory/benches/cricut-midi-seven/outputs/fret/gen_fret.py",
    "sha256": "301f6ffc2529d7193cc57fd7406e5c6da01340d1064288253dad7fa5a5507481",
    "fixes": [],
    "dest": "reference/copper/fret/legacy/gen_fret.py"
  },
  {
    "id": "fret.generator/rev-a",
    "kind": "canonical",
    "source": "/Users/obsidian/Projects/hackbuild/fab-knowledge/originals/fret/files/gen_fret.py",
    "sha256": "301f6ffc2529d7193cc57fd7406e5c6da01340d1064288253dad7fa5a5507481",
    "fixes": [
      "tools/py/copper/run_legacy_gen.py runs it byte identical from a temp dir with the shipped inputs and the logo literal replaced in memory; tools/py/copper/test_oracle.py holds the run to the M05-T13 table (M05-T13)",
      "fan lane assignment (version 2) ported to packages/copper/src/vinyl/lanes.ts and the shared helpers to packages/copper/src/vinyl/helpers.ts; the lanes each net took are held by packages/copper/test/lanes.test.ts through tools/py/copper/dump_lanes.py (M05-T14)",
      "ported to packages/copper as declarations: reference/copper/fret/build.ts with its P dict in chase.surface.ts, evaluated by packages/copper/src/vinyl/draft.ts; the gates as a program run by packages/checks/src/copper/program.ts, one run body per family (M05-T15)"
    ],
    "dest": "reference/copper/fret/legacy/gen_fret.py"
  }
]
