[
  {
    "id": "collar.print-card-024/download",
    "kind": "copy",
    "source": "fab-knowledge:evidence/x/downloads/dl-baffle-inlay-coin/collar/collar-print-card (1).txt",
    "sha256": "23b7d19d80e18ccf77cb330b74739d5b06a2216b8487d56dde022386ebd36c08",
    "fixes": [],
    "dest": null
  },
  {
    "id": "collar.print-card-024/nfc-card",
    "kind": "copy",
    "source": "fab-knowledge:originals/collar/files/owner-collar-print-card-20260830-nfc-024.txt",
    "sha256": "23b7d19d80e18ccf77cb330b74739d5b06a2216b8487d56dde022386ebd36c08",
    "fixes": [],
    "dest": "designs/collar/test/fixtures/owner-collar-print-card-20260830-nfc-024.txt"
  },
  {
    "id": "collar.print-card-024/nfc-fixture",
    "kind": "copy",
    "source": "fab-knowledge:originals/collar/files/owner-collar-print-card-20260830-nfc-024.txt",
    "sha256": "23b7d19d80e18ccf77cb330b74739d5b06a2216b8487d56dde022386ebd36c08",
    "fixes": [],
    "dest": "designs/collar/test/nfc-pause.fixture.ts"
  },
  {
    "id": "collar.print-card-024/owner-20260830",
    "kind": "canonical",
    "source": "fab-knowledge:originals/collar/files/owner-collar-print-card-20260830-nfc-024.txt",
    "sha256": "23b7d19d80e18ccf77cb330b74739d5b06a2216b8487d56dde022386ebd36c08",
    "fixes": [],
    "dest": null
  }
]
