[
  {
    "id": "sparger-w.sim/rev2",
    "kind": "canonical",
    "source": "/Users/obsidian/Projects/hackbuild/fab-knowledge/originals/sparger-w/files/source/sim_w_template.html",
    "sha256": "c7b9f67d2cf115db42f8155978a2228523c2ac23ab750ba7f380d98be8b22a82",
    "fixes": [],
    "dest": null
  }
]
