[
  {
    "id": "inlay.face-editor/knuckle-evidence",
    "kind": "copy",
    "source": "fab-knowledge:evidence/x/knuckle/src/part6.js",
    "sha256": "7ccd08dd86fb3dbf936ac47cda01fb210168e3690198771b07a9ac3024cc7a8a",
    "fixes": [],
    "dest": null
  },
  {
    "id": "inlay.face-editor/knuckle-part6",
    "kind": "canonical",
    "source": "fab-knowledge:originals/knuckle/files/src/part6.js",
    "sha256": "7ccd08dd86fb3dbf936ac47cda01fb210168e3690198771b07a9ac3024cc7a8a",
    "fixes": [
      "four corner scale handles, rotate dot on a 26 px stem, 9 px hit radius (part6.js:405, 439, 444)",
      "centre snap within 0.6 mm with guide lines, alt turns it off (part6.js:479 to 482, 529)",
      "rotate snaps to 0, 90 and 180 within 4 deg, shift gives 15 deg steps (part6.js:539)",
      "wheel zoom about the pointer from 0.5 to 8 (part6.js:547)",
      "packages/ui-core/src/artboard/hit.ts: mm2px and px2mm (406, 407), layerHandles (433 to 442), insideBox (443), hitTest (444 to 450), the move snap (526 to 530) and the rotate snap (536 to 540)"
    ],
    "dest": "packages/ui-core/src/artboard/controller.ts"
  },
  {
    "id": "inlay.face-editor/knuckle-src-zip",
    "kind": "copy",
    "source": "fab-knowledge:evidence/x/knuckle/knuckle-src.zip",
    "sha256": "76098e29ab79bb32d0aef58ab155a09727b7277c76531e779c1469d8671527e2",
    "fixes": [],
    "dest": null
  }
]
