[
  {
    "id": "collar.owner-export/20260919",
    "kind": "canonical",
    "source": "/Users/obsidian/Projects/hackbuild/fab-knowledge/originals/collar/files/owner-collar-coin-44mm-20260919.3mf",
    "sha256": "71c3629d716d8f2290d347136e867f5b6c5d1ca3dd819153ea9a5ce451447fec",
    "fixes": [],
    "dest": null
  },
  {
    "id": "collar.owner-export/download",
    "kind": "copy",
    "source": "/Users/obsidian/Projects/hackbuild/fab-knowledge/evidence/x/downloads/dl-baffle-inlay-coin/collar/collar-coin-44mm (8).3mf",
    "sha256": "71c3629d716d8f2290d347136e867f5b6c5d1ca3dd819153ea9a5ce451447fec",
    "fixes": [],
    "dest": null
  }
]
